{"schema_version":"1.0","run_id":"immature-label","training_cutoff":"2024-01-31T00:00:00Z","evaluation_cutoff":"2024-06-30T00:00:00Z","records":"records.jsonl","splits":[{"name":"train","record_ids":["train_1"]},{"name":"validation","record_ids":["val_1"]},{"name":"test","record_ids":["test_1"]}],"artifacts":[]}
